hoimalnad_kannada_169	ಬಾಯಲ್ಲಿ ಹಲ್ಲಿಲ್ಲ, ಮಯಲ್ಲಿ ಶಕ್ತಿ ಇಲ್ಲ, ತಲೆಯಲ್ಲಿ ಕೂದಲಿಲ್ಲ, ಆದ್ರೂ ಎಲ್ಲುನ್ನು ಕಾಡತಿನಿ ನಾನ್ಯಾರು.	ಸೊಳ್ಳೆ
hoimalnad_kannada_170	ಅಕ್ಷರಗಳಿದ್ದರೂ ಪುಸ್ತಕವಲ್ಲ,ಸಿಂಹವಿದ್ದರೂ ಅರಣ್ಯವಲ್ಲ,ದುಂಡಾಗಿದ್ದರೂ ಚಕ್ರವಲ್ಲ,ನಾನ್ಯಾರು.	నాణ్య
hoimalnad_kannada_171	ಗಂಟೆ ಹೊಡೆಯುತ್ತಾನೆ ಪೂಜಾರಿ ಅಲ್ಲ, PAPER ಅರಿಯುತ್ತಾನೆ ಆದರೆ ಹುಚ್ಚುನೂ ಅಲ್ಲ, ಹಣ ಕೇಳುತ್ತಾನೆ ಭಿಕ್ಷುಕ ಅಲ್ಲ	ಕಂಡಕ್ಟರ್
hoimalnad_kannada_172	ಹಿಡಿದರೆ ಹಿಡಿಯಷ್ಟು ಬಿಟ್ಟರೆ ಮನೆತುಂಬ	ದೀಪದ ಬೆಳಕು
hoimalnad_kannada_173	ಕಾಲಿಲ್ಲದೆ ನಡೆಯುವುದು ಬಾಯಿಲ್ಲದೆ ನುಡಿಯುವುದು ಇದರ ಹೊಟ್ಟೆ ಹಲವಕ್ಕೆ ಮನೆಯಾಗಿರುವುದು	ನದಿ
hoimalnad_kannada_174	ಚೋಟುದ್ದ ಹುಡುಗಿಗೆ ಮಾರುದ್ದ ಜಡೆ	ಸೂಜಿ ದಾರ
hoimalnad_kannada_175	ಊರುಂಟು ಜನರಿಲ್ಲ ನದಿಯುಂಟು ನೀರಿಲ್ಲ	ಭೂಪಟ.
hoimalnad_kannada_176	ಚಿಕ್ಕ ಬೋರನಿಗೆ ಬಾಲದಲ್ಲಿ ಕತ್ತಿ	ಹುರಳಿಕಾಯಿ
hoimalnad_kannada_177	ಬಿಳಿಯ ಹೊಲದಲ್ಲಿ ಕರಿ ಕಾಳು ಕೈಯಲ್ಲಿ ಬಿತ್ತುತ್ತಾರೆ ಬಾಯಲ್ಲಿ ಏತ್ತುತ್ತಾರೆ ನಾನು ಯಾರು	ಪುಸ್ತಕ ಮತ್ತು ಅಕ್ಷರಗಳು
hoimalnad_kannada_178	ಮೂರು ಕಡೆ ನೀರು ನೆತ್ತಿ ಮೇಲೆ ಬೆಟ್ಟ ಹಾಗಾದರೆ ನಾನು ಯಾರು?	ಭಾರತ
hoimalnad_kannada_179	ನಾಲ್ಕು ಕಂಬಗಳುಂಟು ದೇವಾಲಯವಲ್ಲ; ಎರಡು ಮೊರಗಳುಂಟು ಕೇರಲಾಗುವುದಿಲ್ಲ; ಒಂದು ಕಹಳೆಯುಂಟು ಊದಲಾಗುವುದಿಲ್ಲ; ಹಾಗಾದರೆ ನಾನು ಯಾರು?	ಆನೆ
hoimalnad_kannada_180	ಕರಿ ಕಂಬ್ಬಿ ನೆಂಟ, ಸರೊತ್ತಿನಲ್ಲಿ ಹೊಂಟ, ಅವನ್ಯಾರು?	ಹೆಗ್ಗಣ
hoimalnad_kannada_181	ರಾಮನಂತ ಸಮುದ್ರ ರತ್ನದಂತ ಮೀನು ನೀರು ಬತ್ತಿಹೋದ್ರೆ ಮೀನು ಸತ್ತು ಹೋಗುತ್ತೆ	ದೀಪ/ಹಣತೆ
honalu_Kannada_1	ಬಿಳಿ ಸಿಪಾಯಿಗೆ ಕರಿಟೋಪಿ	ಬೆಂಕಿಕಡ್ಡಿ
honalu_Kannada_2	ಬಿಳಿ ಸಮುದ್ರದ ಮೇಲೆ ಬೆಳ್ಳಿ ಬೆಟ್ಟ ತೇಲುತ್ತೆ	ಬೆಣ್ಣೆ
honalu_Kannada_3	ಅಂಕುಡೊಂಕಿನ ಮನೆ-ಬಡಗಿ ಕಟ್ಟದ ಮನೆ-ಬಾಚಿ ಮುಟ್ಟದ ಮನೆ	ಹುತ್ತ
honalu_Kannada_4	ನೆತ್ತಿಯಲಿ ಉಂಬುವುದು-ಸುತ್ತಲೂ ಚೆಲ್ಲುವುದು, ಎತ್ತಿದರೆ ಎರಡು ಹೋಳಾಗುವುದು	ರಾಗಿಕಲ್ಲು
honalu_Kannada_5	ಜನರಿಲ್ಲದ ನಾಡು-ಮರವಿಲ್ಲದ ಕಾಡು, ನೀರಿಲ್ಲದ ತೋಡು-ಮೀನಿರದ ಕಡಲು	ಬೂಪಟ
honalu_Kannada_6	ಮೂರು ಬಗೆ ಹಕ್ಕಿ ಒಂದೇ ಗೂಡಿಗೆ ಹೋಗ್ತವೆ, ಬರೋ ಹೊತ್ತಿಗೆ ಒಂದೇ ಬಗೆಯಾಗ್ತವೆ.	ಎಲೆ ಅಡಕೆ ಸುಣ್ಣ
honalu_Kannada_7	ಕಲ್ಲರಳಿ ಹೂವಾಯ್ತು-ಎಲ್ಲರಿಗೂ ಬೆಳಕಾಯ್ತು, ಮಲ್ಲಯ್ಯನ ಶಿಕರಕ್ಕೆ ಬೆಳಕಾಯ್ತು	ಸುಣ್ಣ
honalu_Kannada_8	ಚಿಪ್ಪುಂಟು ಆಮೆಯಲ್ಲ-ಜುಟ್ಟುಂಟು ರಿಸಿಯಲ್ಲ, ಮೂರು ಕಣ್ಣುಗಳುಂಟು ಮುಕ್ಕಣ್ಣನಲ್ಲ	ತೆಂಗಿನಕಾಯಿ
honalu_Kannada_9	ಬಡಗಿ ಮಾಡಿದ ಬಂಡಿಯಲ್ಲ-ಮನುಶ್ಯ ಮಾಡಿದ ಯಂತ್ರವಲ್ಲ, ಒಂದು ನಿಮಿಶವೂ ಪುರುಸೊತ್ತಿಲ್ಲ	ಬೂಮಿ
honalu_Kannada_10	ರಾಜರಾಣಿಯರುಂಟು ರಾಜ್ಯವಲ್ಲ-ಹೂಬಳ್ಳಿಯುಂಟು ತೋಟವಲ್ಲ, ಅಂಕಿ ಅಕ್ಶರಗಳುಂಟು ಪುಸ್ತಕವಲ್ಲ	ಬೆಳ್ಳಿ ರೂಪಾಯಿ
honalu_Kannada_11	ಕಪ್ಪುಂಟು ಕಸ್ತುರಿಯಲ್ಲ-ಬಿಳುಪುಂಟು ಸುಣ್ಣವಲ್ಲ, ನೀರುಂಟು ಬಾವಿಯಲ್ಲ-ರೆಕ್ಕೆಯುಂಟು ಪಕ್ಶಿಯಲ್ಲ	ಕಣ್ಣು
honalu_Kannada_12	ಅಕ್ಕ ಅಕ್ಕ ಬಾವಿ ನೋಡ-ಬಾವಿಯೊಳಗಿನ ನೀರು ನೋಡ, ನೀರಿನೊಳಗಿನ ಬಳ್ಳಿ ನೋಡ, ಬಳ್ಳಿಯೊಳಗಿನ ಹೂವ ನೋಡ	ಎಣ್ಣೆ-ಬತ್ತಿ-ಜ್ಯೋತಿಯಿಂದ ಕೂಡಿದ ದೀಪ
honalu_Kannada_13	ಹಸಿರು ಗಿಡ್ದಾಗ ಮಸರ ಚೆಲ್ಯೇದ	ಹತ್ತಿ
honalu_Kannada_14	ಅಂಬರದಲ್ಲಿ ಆಡುವುದು ಪಕ್ಶಿಯು ತಾನಲ್ಲ, ಕೊಂಬು ಬಾಲಗಳುಂಟು ಮ್ರುಗ ಜಾತಿಯಲ್ಲ, ಬಿಲ್ಲುಬಾಣಗಳುಂಟು ಹೊಡೆಯುವವರು ಇಲ್ಲ ಇದ ಹೇಳಬಲ್ಲ ಜಾಣನಿಗೆ ಅರಿಯದೇ ಇದ್ದಿದ್ದಲ್ಲ	ಗಾಳಿಪಟ
kannadachetana_Kannada_1	ಗಿರಿಗಿರ ತಿರುಗುತ್ತದೆ ಸುಸ್ತಾಗಿ ಬರುತ್ತದೆ.	ಬುಗರಿ
kannadachetana_Kannada_2	ಹಸಿರು ಗಿಡದ ಮೇಲೆ ಮೊಸರು ಚಲ್ಲಿದೆ.	ಮಲ್ಲಿಗೆ ಗಿಡ
kannadachetana_Kannada_3	ಬೆಳ್ಳಿ ಸಮುದ್ರದ ಮೇಲೆ ಕಪ್ಪು ಸೂರ್ಯ.	ಕಣ್ಣು
kannadachetana_Kannada_4	ಅಂಗಡಿಯಿಂದ ತಂದು ಮುಂದಿಟ್ಟುಕೂಂಡು ಅಳೋದು.	ಈರುಳ್ಳಿ
kannadachetana_Kannada_5	ಅಗಲವಾದ ಮಾಳಿಗೆಗೆ ಒಂದೆ ಕಂಬ.	ಛತ್ರಿ
kannadachetana_Kannada_6	ಎರಡು ಬಾವಿಗೆ ನಡುವೆ ಒಂದೆ ಕಣ್ಣು.	ಮೂಗು
kannadachetana_Kannada_7	ಅಪ್ಪನ ದುಡ್ಡು ಎಣಿಸೂಕಾಗಲ್ಲ ಅಮ್ಮನ ಹಾಸಿಗೆ ಮೂಡಿಸೋಕಾಗಲ್ಲ.	ಆಕಾಶ
kannadachetana_Kannada_8	ನೀಲಿ ಸಾಗರದಲ್ಲಿ ಬೆಳ್ಳಿಯ ಮೀನುಗಳು.	ತಾರೆಗಳು
kannadachetana_Kannada_9	ಲಟಪಟ ಲೇಡಿ ಒಂದೆ ಕಣ್ಣು.	ಸೂಜಿ
kannadachetana_Kannada_10	ಕಣ್ಣಿಗೆ ಕಾಣಲಿಲ್ಲ ಕೈಗೆ ಸಿಗೂದಲ್ಲ.	ಗಾಳಿ
kannadachetana_Kannada_11	ಮುಳ್ಳುಗಳಿವೆ ಅಪಾಯವಿಲ್ಲ, ಸಂಖ್ಯೆಗಳಿವೆ ಲೆಕ್ಕದ ಪುಸ್ತಕವಲ್ಲ, ಗಂಟೆ ಹೊಡೆಯುತ್ತದೆ ದೇವಾಲಯವಲ್ಲ.	ಗಡಿಯಾರ
kannadachetana_Kannada_12	ಅಂಗಣ್ಣ ಮಂಗಣ್ಣ ಅಂಗಿ ಬಿಚ್ಚಿ ನುಂಗಣ್ಣ.	ಬಾಳೆಹಣ್ಣು
kannadachetana_Kannada_13	ಬಿಳಿ ಸರದಾರನಿಗೆ ಕರಿ ಟೋಪಿ.	ಬೆಂಕಿಕಡ್ಡಿ
kannadadeevige_Kannada_riddle_1	ಗೂಡಿನಲ್ಲಿನ ಪಕ್ಷಿ ನಾಡೆಲ್ಲ ನೋಡುತ್ತದೆ	ಕಣ್ಣು
kannadadeevige_Kannada_riddle_2	ಎಲೆ ಇಲ್ಲ, ಸುಣ್ಣ ಇಲ್ಲ, ಬಣ್ಣವಿಲ್ಲ ತುಟಿ ಕೆಂಪಗಾಗಿದೆ, ಮಳೆಯಿಲ್ಲ , ಬೆಲೆಯಿಲ್ಲ , ಮೈ ಹಸಿರಾಗಿದೆ	ಗಿಳಿ
kannadadeevige_Kannada_riddle_3	ಮನೆ, ಮನೆಗೆರಡು ಬಾಗಿಲು, ಬಾಗಿಲ ಮುಂದೆ , ಮುಚ್ಚಿದರೆ ಹಾನಿ ಇದೇನು?	ಮೂಗು, ಬಾಯಿ
kannadadeevige_Kannada_riddle_4	ಸುತ್ತ ಮುತ್ತ ಸುಣ್ಣದ ಗೋಡೆ, ಎತ್ತ ನೋಡಿದರೂ ಬಾಗಿಲಿಲ್ಲ ಇದು ಏನು?	ಮೊಟ್ಟೆ
kannadadeevige_Kannada_riddle_5	ಇದ್ದಲು ನುಂಗುತ್ತ , ಗದ್ದಲ ಮಾಡುತ್ತಾ, ಉದ್ದಕ್ಕೂ ಓಡುತ್ತಾ ಮುಂದಕ್ಕೆ ಸಾಗುವ ನಾನ್ಯಾರು?	ರೈಲು
kannadadeevige_Kannada_riddle_6	ಮೊಟ್ಟೆ ಒಡೆಯೋ ಹಾಗಿಲ್ಲ ಕೊಡ ಮುಳುಗಿಸೋ ಹಾಗಿಲ್ಲ ಬರಿ ಕೊಡೆ ತಗೊಂಡು ಬಾರೋ ಹಾಗಿಲ್ಲ	ತೆಂಗು
kannadadeevige_Kannada_riddle_7	ಕಡಿದರೆ ಕಚ್ಚೋಕೆ ಆಗೋಲ್ಲ , ಹಿಡದ್ರೆ ಮುಟ್ಟೋಕೆ ಸಿಗೋಲ್ಲ	ನೀರು
kannadadeevige_Kannada_riddle_8	ಒಂದು ರುಮಾಲು ನಮ್ಮಪ್ಪನೂ ಸುತ್ತಲಾರ.	ದಾರಿ
kannadadeevige_Kannada_riddle_9	ಹುಟ್ಟುತ್ತಲೇ ಹುಡುಗ ತಲೆಯಲ್ಲಿ ಟೋಪಿ ಹಾಕಿರುತ್ತೆ .	ಬದನೆಕಾಯಿ
kannadadeevige_Kannada_riddle_10	ಸಾಗರ ಪುತ್ರ ,ಸಾರಿನ ಮಿತ್ರ.	ಉಪ್ಪು
kannadadeevige_Kannada_riddle_11	ಕಣ್ಣಿಲ್ಲ, ಕಾಲಿಲ್ಲ ,ಆದರು ಚಲಿಸುತಿದೆ ಯಾವುದು ಎಲ್ಲಿದೆ ಬಲ್ಲಿದನ ಹೇಳಿರಲ.	ನದಿ
kannadadeevige_Kannada_riddle_12	ಮೋಟು ಗೋಡೆ ಮೇಲೆ, ದೀಪ ಉರೀತಿದೆ.	ಮೂಗುಬೊಟ್ಟು
kannadadeevige_Kannada_riddle_13	ಕತ್ತಲೆ ಮನೆಯಲಿ ಕಾಳವ್ವ ಕುಂತವ್ಳೆ ಕುಯ್ಯೋ, ಮರ್ರೋ ಅಂತವಳೇ	ತಂಬೂರಿ
kannadadeevige_Kannada_riddle_14	ನೀರಿಲ್ಲದ ಸಮುದ್ರ, ಜನರಿಲ್ಲದ ಪಟ್ಟಣ, ಸಂಚಾರವಿಲ್ಲದ ಮಾರ್ಗಗಳು ಎಲ್ಲಿ?	ನಕ್ಷೆ
kannadadeevige_Kannada_riddle_15	ಒಬ್ಬನನ್ನು ಹಿಡಿದರೆ ಎಲ್ಲಾರ ಮರ್ಜಿಯು ಗೊತ್ತಾಗುತ್ತದೆ.	ಅನ್ನದ ಅಗುಳು
kannadadeevige_Kannada_riddle_16	ಮೇಲೆ ನೋಡಿದರೆ ನಾನಾ ಬಣ್ಣ, ಉಜ್ಜಿದರೆ ಒಂದೇ ಬಣ್ಣ.	ಸಾಬೂನು
kannadadeevige_Kannada_riddle_17	ಒಂದು ಕೊಂಬಿನ ಗುಳಿ ಅದರ ತಲೆಯೆಲ್ಲಾ ಮುಳ್ಳು.	ಬದನೆಕಾಯಿ
kannadadeevige_Kannada_riddle_18	ನಾನು ತುಳಿದೆ ಅದನ್ನ, ಅದು ತುಳಿಯೆತು ನನ್ನನ್ನ.	ನೀರು
kannadadeevige_Kannada_riddle_19	ಕೊಳದ ಒಳಗೆ ಒಂದು ಮರ ಹುಟ್ಟಿ ,ಬೇರು ಇಲ್ಲ ,ನೀರು ಇಲ್ಲ.	ಎಣ್ಣೆ ದೀಪ
kannadadeevige_Kannada_riddle_20	ಬಡ ಬಡ ಬಂದ ಅಂಗಿ ಕಳಚಿದ ,ಬಾವಿಯೊಳಗೆ ಬಿದ್ದ.	ಬಾಳೆ ಹಣ್ಣು
kannadadeevige_Kannada_riddle_21	ನೋಡಿದರೆ ನೋಟಗಳು ,ನಕ್ಕರೆ ನಗುಗಳು ,ಒಡೆದರೆ ತುಂಡುಗಳು.	ಕನ್ನಡಿ
kannadadeevige_Kannada_riddle_22	ಅಕ್ಕ ಪಕ್ಕ ಚದುರಂಗ ,ಅದರ ಹೂವು ಪದುರಂಗ ಅದರ ಹೆಸರು ಅಯ್ಯಯ್ಯಪ್ಪ .ಇದು ಏನು?	ದತ್ತುರಿಯ ಮುಳ್ಳು
kannadadeevige_Kannada_riddle_23	ವನದಲ್ಲಿ ಹುಟ್ಟಿ ,ವನದಲ್ಲಿ ಬೆಳೆದು ,ವನದಿಂದ ಹೊರಟು ವನಜಲೊನೆ ಶಿರಕ್ಕೆರುವರು.	ಕಮಲ
kannadadeevige_Kannada_riddle_24	ಕಲ್ಲು ಕೋಳಿ ಕುಗುತ್ತದೆ, ಮುಲ್ಲ ಚೂರಿ ಹಾಕುತ್ತಾನೆ.	ಗಿರಣಿ
kannadadeevige_Kannada_riddle_25	ಚರಚರ ಕೊಯ್ತದೆ ಕತ್ತಿ ಅಲ್ಲ, ಮಿಣಿಮಿಣಿ ಮಿಂಚುತ್ತದೆ ಮಿಂಚಲ್ಲ, ಪೆಟ್ಟಿಗೆಗೆ ತುಂಬ್ತದೆ ದಾಗಿನ ಅಲ್ಲ.	ಗರಗಸ
kannadadeevige_Kannada_riddle_26	ಕರಿ ಗುಡ್ಡ	ಬಿಳಿ ನೀರು ಅದ್ರಾಗೆ ಕುಂತವಳೇ ಚಂಪರಾಣಿ.-ಗಡಿಗೆಮಜ್ಜಿಗೆ
kannadadeevige_Kannada_riddle_27	ಕೆಂಪು ಕುದುರೆ ಮೇಲೆ ಒಬ್ಬ ಏರುತ್ತಾನೆ, ಒಬ್ಬ ಇಳಿಯುತ್ತಾನೆ .	ರೊಟ್ಟಿ, ದೋಸೆ
kannadadeevige_Kannada_riddle_28	ಕೆಂದ ಕುದುರೆ ,ಬಿಳಿ ತಡಿ, ಕರೆ ಲಗಾಮು, ಅಣ್ಣ ಅತ್ತಾನೆ, ತಮ್ಮ ಇಳಿತ್ತಾನೆ	ಬೆಂಕಿ, ಸುಣ್ಣ ಹಚ್ಚಿದ ಹಂಚು, ಹೊಗೆ, ರೊಟ್ಟಿ
kannadadeevige_Kannada_riddle_29	ಬಾ ಅಂದರೆ ಬರೋಲ್ಲ , ಹೋಗು ಅಂದರೆ ಹೋಗೋಲ್ಲ	ಮಳೆ
kannadadeevige_Kannada_riddle_30	ನಾ ಇರುವಾಗ ಬರುತ್ತೆ , ನಾ ಹೋದ ಮೇಲೂ ಇರುತ್ತೆ	ಕೀರ್ತಿ
kannadadeevige_Kannada_riddle_31	ಕಾಲಿಲ್ದ ಹುಡುಗಿಗೆ ಮಾರುದ್ದ ಕಡಿವಾಣ	ಸೂಜಿ
kannadadeevige_Kannada_riddle_32	ಕೆಂಪು ಕುದುರೆಗೆ ಲಗಾಮು, ಓಬ್ಬ ಹತ್ತುತ್ತಾನೆ , ಇನ್ನೊಬ್ಬ ಇಳಿತಾನೇ	ಬೆಂಕಿ,ಬಾಣಲೆ, ದೋಸೆ
kannadadeevige_Kannada_riddle_33	ಕಲ್ಲರಳಿ ಹೂವಾಗಿ, ಎಲ್ಲರಿಗೂ ಬೇಕಾಗಿ, ಮಲ್ಲಿಕಾರ್ಜುನನ ಗುಡಿಗೆ ಬೆಳಕಾಗಿ, ಬಲ್ಲವರು ಹೇಳಿ	ಸುಣ್ಣ
kannadadeevige_Kannada_riddle_34	ದಾಸ್ ಬುರುಡೆ ದೌಲಥ ಬುರುಡೆ, ಲೋಕಕ್ಕೆಲ್ಲ ಎರಡೇ ಬುರುಡೆ	ಸೂರ್ಯ , ಚಂದ್ರ
kannadadeevige_Kannada_riddle_35	ಹಾರಾಡುತ್ತಿದೆ ಗಾಳಿಪತವಲ್ಲ , ಬಣ್ಣ ಮೂರಿರುವುದು ಕಾಮನಬಿಲ್ಲಲ್ಲ	ಧ್ವಜ
kannadadeevige_Kannada_riddle_36	ಬಿಡಿಸಿದರೆ ಹೂವು, ಮದಚಿದರೆ ಮೊಗ್ಗು ,ಇದು ಏನು?	ಛತ್ರಿ
kannadadeevige_Kannada_riddle_37	ಕಪ್ಪು ಕಂಬಳಿ ನೆಂಟ ಎಲ್ಲವನು ನಾಶ ಮಾಡೋಕೆ ಹೊಂಟ	ಇಲಿ
kannadadeevige_Kannada_riddle_38	ಒಂದು ಮನೆಯಲ್ಲಿ ಮೂರು ಜನ ಅಕ್ಕ	ತಂಗಿಯರಿದ್ದಾರೆ ಆದರೆ ಒಬ್ಬರ ಮುಖ ಕಂಡರೆ ಒಬ್ಬರಿಗೆ ಕಾಣೋಲ್ಲ- ಜಾದಳಕಾಯಿ
kannadadeevige_Kannada_riddle_39	ಅಂಕಡೊಂಕಿನ ಬಾವಿ ಹೊಕ್ಕು ನೋಡಿದ್ರೆ ಮುಕ್ಕ ನೀರಿಲ್ಲ	ಕಿವಿ
kannadadeevige_Kannada_riddle_40	ತಲೆ ಇಲ್ಲ , ನಡು ಇಲ್ಲ , ಕೈಗಳಿದ್ದರು ಬೆರಳಿಲ್ಲ	ಕೋಟು ಅಂಗಿ
kannadadeevige_Kannada_riddle_41	ತಿಂಡಿಗೆ ಕಡಿಮೆ ಇಲ್ಲ ,ತೀರ್ಥ ಕುಡಿದರೆ ಸಾವು	ವಿಷ
kannadadeevige_Kannada_riddle_42	ಒಬ್ಬಳು ಮುಲುಗಿದಳು, ಒಬ್ಬಳು ಕರಗಿದಳು , ಒಬ್ಬಳು ತೇಲಿದಳು	ಅಡಿಕೆ , ಸುಣ್ಣ
kannadadeevige_Kannada_riddle_43	ಕಿರೀಟ ಇದೆ ರಾಜ ಅಲ್ಲ, ಕಲ ತಿಳಿಸುತ್ತ್ತೆ ಗಡಿಯಾರವಲ್ಲ	ಕೋಳಿ
kannadadeevige_Kannada_riddle_44	ಒಂದು ಮರ , ಮರದಾಗ ಅಲ್ಲ, ಅಲ್ಲಿನಾಗ ಕೊಬ್ರಿ ಗುಂಡ	ಆಕಾಶ ನಕ್ಷತ್ರ ಚಂದ್ರ
kannadadeevige_Kannada_riddle_45	ಹುಲಿಯ ಚಿಕ್ಕಮ್ಮ , ಇಲಿಯ ಮುಕ್ಕಮ್ಮ	ಬೆಕ್ಕು
kannadadeevige_Kannada_riddle_46	ಕಲ್ಲಲ್ಲಿ ಹುಟ್ಟುವುದು, ಕಲ್ಲಲ್ಲಿ ಬೆಳೆಯುವುದು, ನೆತ್ತಿಯಲ್ಲಿ ಕುತಗುಟ್ಟುವುದು	ಸುಣ್ಣ
kannadadeevige_Kannada_riddle_47	ಕಾಂತಾಮಣಿ ಎಂಬ ಪಕ್ಷಿ, ಚಿಂತಾಮಣಿ ಎಂಬ ಕೆರೆ, ಕೆರೆಯಲ್ಲಿ ನೀರಿಲ್ದೆ ಹೋದ್ರೆ ಪಕ್ಷಿಗೆ ಮರಣ	ದೀಪ
kannadadeevige_Kannada_riddle_48	ಕಲ್ಲು ತುಳಿಯುತ್ತೆ, ಮುಳ್ಳು ಮೆಯುತ್ತೆ, ನೀರು ಕಂಡ್ರೆ ನಿಲ್ಲುತ್ತೆ	ಚಪ್ಪಲಿ
kannadadeevige_Kannada_riddle_49	ಬಿಳಿ ಆಕಾಶದಲ್ಲಿ ಕಪ್ಪು ನಕ್ಷತ್ರಗಳು,ಇದನ್ನು ನೋಡಲು ಜನ ಕಾದಿಹರು	ನಾಣ್ಯ
kannadadeevige_Kannada_riddle_50	ಹಸಿರು ಮುಖಕ್ಕೆ ವಿಪರೀತ ಕೋಪ , ಕೋಪ ಮಾಡಿಕೊಳ್ಳದೆ ನಾನ್ಯಾರೆಂದು ಹೇಳಿ?	ಮೆಣಸಿನಕಾಯಿ
kannadadeevige_Kannada_riddle_51	ಹಗಲಲ್ಲಿ ಮಾಯಾ ರಾತ್ರಿಯಲ್ಲಿ ಪ್ರತ್ಯಕ್ಷ ?ನಾನ್ಯಾರು ಹೇಳಿ?	ನಕ್ಷತ್ರ
kannadadeevige_Kannada_riddle_52	ಬಾಯಲ್ಲಿ ಹಲ್ಲಿಲ್ಲ, ಮಯಲ್ಲಿ ಶಕ್ತಿ ಇಲ್ಲ , ತಲೆಯಲ್ಲಿ ಕೂದಲಿಲ್ಲ , ಆದ್ರೂ ಎಲ್ರುನ್ನು ಕಾಡತಿನಿ ನಾನ್ಯಾರು.	ಸೊಳ್ಳೆ
kannadadeevige_Kannada_riddle_53	ಕರಿ ಕಂಬ್ಳಿ ನೆಂಟ, ಸರೊತ್ತಿನಲ್ಲಿ ಹೊಂಟ, ಅವನ್ಯಾರು?	ಹೆಗ್ಗಣ
thinkbangalore_Kannada_1	ಕಾಲಿಲ್ಲದೆ ನಡೆಯುವುದು , ಬಾಯಿಲ್ಲದೆ ನುಡಿಯುವುದು, ಇದರ ಹೊಟ್ಟೆ ಹಲವಕ್ಕೆ ಮನೆಯಾಗಿರುವುದು	ನದಿ
thinkbangalore_Kannada_2	ಕುಡಿಕೆಯಲ್ಲಿ ಮೆಣಸು	ಪರಂಗಿ ಹಣ್ಣು
thinkbangalore_Kannada_3	ಹಿಡಿ ಹಿಡಿದರೆ ಹಿಡಿ ತುಂಬಾ ! ಬಿಟ್ಟರೆ ಮನೆ ತುಂಬಾ	ದೀಪ
thinkbangalore_Kannada_4	ಮೇಲೆ ಹಸಿರು , ಒಳಗೆ ಕೆಂಪು , ತಿಂದರೆ ತಂಪು	ಕಲ್ಲಂಗಡಿ
thinkbangalore_Kannada_5	ಹಾರಿದರೆ ಹನುಮಂತ , ಕೂಗಿದರೆ ರಾವಣ , ಕುಳಿತರೆ ಮುನಿರಾಮ	ಕಪ್ಪೆ
thinkbangalore_Kannada_6	ಚಿಕ್ಕ ಮನೇಲಿ ಚಕ್ಕೆ ತುಂಬಿವೆ	ಹಲ್ಲು
thinkbangalore_Kannada_7	ಉದ್ದ ಮರದಲ್ಲಿ ಕೆಂಪು  ಸನ್ಯಾಸಿ	ಅಡಿಕೆ ಕಾಯಿ
thinkbangalore_Kannada_8	ನಿನ್ನ ಹೊಟ್ಟೆಯ ಮೇಲೆ , ನನ್ನ ಹೊಟ್ಟೆ	ರಾಗಿ ಕಲ್ಲು
thinkbangalore_Kannada_9	ಕಲ್ಲರಳಿ ಹೂವಾಗಿ , ಎಲ್ಲರಿಗೂ ಬೇಕಾಗಿ  , ಮಲ್ಲಿಕಾರ್ಜುನನ ಶಿಖರಕ್ಕೆ ಬೆಳಕಾಗಿ ಬಲ್ಲವರು ಹೇಳಿ ಸರ್ವಜ್ಞ	ಸುಣ್ಣ
thinkbangalore_Kannada_10	ಸತ್ತವನೇ ಸಾವಿನ ಸುದ್ದಿ ತಗೊಂಡು ಹೋಗ್ತಾನೆ	ಹಲಸಿನ ಹಣ್ಣು
thinkbangalore_Kannada_11	ಚಿಕ್ಕ ಚಿಕ್ಕ ಪೆಟ್ಟಿಗೆ , ಚಿನ್ನದ ಪೆಟ್ಟಿಗೆ , ಮುಚ್ಚಿ ತೆಗೆದರೆ ಮುನ್ನೂರು ಪೆಟ್ಟಿಗೆ	ದಾಳಿಂಬೆ ಹಣ್ಣು
thinkbangalore_Kannada_12	ಚೆಲ್ಲೋದುಂಟು , ಕುಯ್ಯೋದುಂಟು , ತಿನ್ನೋದಿಲ್ಲ	ಕೂದಲು
thinkbangalore_Kannada_13	ಹತ್ನಾರ್ದ ಮರಕ್ಕೆ , ಹತ್ತುತನೆ ಕರಿಯಣ್ಣ	ಇರುವೆ
thinkbangalore_Kannada_14	ಸಾಯೋವರೆಗೂ ಹೂವಿಲ್ಲ , ಹಣ್ಣು ಮಾತ್ರ ಬಿಡ್ತದೆ	ಹತ್ತಿಹಣ್ಣು
thinkbangalore_Kannada_15	ಕಿರೀಟವುಂಟು ರಾಜನಲ್ಲ , ಗಡ್ಡವುಂಟು ತುರುಕನಲ್ಲ	ಹುಂಜ
thinkbangalore_Kannada_16	ಸುತ್ತಮುತ್ತ ಗರಿಕೆ , ನಡುವೆ ಕುಡಿಕೆ	ಕಣ್ಣು
thinkbangalore_Kannada_17	ಹತ್ತಲಾರದ ಮರ , ಎಣಿಸಲಾರದ ಕಾಯಿ	ರಾಗಿ ಗಿಡ
thinkbangalore_Kannada_18	ರಕ್ತವಿಲ್ಲದ  ಮಾಂಸ , ಕರುಳಿಲ್ಲದ ಹೊಟ್ಟೆ	ಸೀಗಡಿ
thinkbangalore_Kannada_19	ಮುಳ್ಳು ಮುಳ್ಳು ಮರದಲ್ಲಿ , ಮುತ್ತು ಮುತ್ತು ಕಾಯಿ	ನಿಂಬೆ ಹಣ್ಣು
thinkbangalore_Kannada_20	ಸಾಸಿವೆ ಗಾತ್ರದ ಕಲ್ಲು ಬಿದ್ದರೆ , ಸಾವಿರ ರೂಪಾಯಿನ ತೋಟ ಹಾಳು !	ಕಣ್ಣು
thinkbangalore_Kannada_21	ಕಪ್ಪೆ ಮುಟ್ಟದ ಕೈಲಾಸದ ನೀರು !	ಎಳೆನೀರು
thinkbangalore_Kannada_22	ಕಲ್ಲನ್ನು ತುಳಿಯುತ್ತೆ ! ಮುಳ್ಳನ್ನು ಮೂಯುತ್ತೆ ! ನೀರು ಕಂಡ್ರೆ ನಿಲ್ಲುತ್ತೆ !	ಚಪ್ಪಲಿ
thinkbangalore_Kannada_23	ಅಮ್ಮನ ಹಾಸಿಗೆ ಸುತ್ತೊಕ್ಕಾಗಲ್ಲ ! ಅಪ್ಪನ ದುಡ್ಡು ಎಣಿಸೋಕ್ಕಾಗಲ್ಲ !	ಆಕಾಶ , ನಕ್ಷತ್ರಗಳು
thinkbangalore_Kannada_24	ನೀಲಿ ಕೆರೇಲಿ ಬಿಳಿ ಮೀನು	ನಕ್ಷತ್ರ
thinkbangalore_Kannada_25	ಕಣ್ಣಿಗೆ ಕಾಣೋದಿಲ್ಲ ! ಕೈಯಿಗೆ ಸಿಗೋದಿಲ್ಲ !	ಗಾಳಿ
thinkbangalore_Kannada_26	ಮಡಿಸಿದರೆ ಮೊಗ್ಗು ! ಬಿಡಿಸಿದರೆ ಹೂವು ! ಪರಿಮಳವಿಲ್ಲ ವಾಸ್ನೆ ಇಲ್ಲ !	ಕೊಡೆ
thinkbangalore_Kannada_27	ಚಿನ್ನ ಬಿಸಾಡುತ್ತಾರೆ ! ಬೆಳ್ಳಿ ತಿಂತಾರೆ !	ಬಾಳೆ ಹಣ್ಣು
thinkbangalore_Kannada_28	ಅಕ್ಷರಗಳಿದ್ದರೂ ಪುಸ್ತಕವಲ್ಲ ! ಸಿಂಹವಿದ್ದರೂ ಅರಣ್ಯವಲ್ಲ ! ದುಂಡಾಗಿದ್ದರೂ ಚಕ್ರವಲ್ಲ ! ನಾನ್ಯಾರು ?	ನಾಣ್ಯ
thinkbangalore_Kannada_29	ಹೋದ ನೆಂಟ ಬಂದ ನೆಂಟ ! ಬಂದ ದಾರಿ ಗೊತ್ತಿಲ್ಲ	ನೆರಳು
thinkbangalore_Kannada_30	ಕಣ್ಣಿಗೆ ಹತ್ತಿರ , ಕಾಲಿಗೆ ದೂರ	ದಿಗಂತ
thinkbangalore_Kannada_31	ಊರುಂಟು ಜನರಿಲ್ಲ ! ನದಿಯುಂಟು ನೀರಿಲ್ಲ ! ರಸ್ತೆಯುಂಟು ವಾಹನವಿಲ್ಲ !  ಹಾಗಾದರೆ ನಾನ್ಯಾರು ?	ಭೂಪಟ
thinkbangalore_Kannada_32	ಅಣ್ಣ ತಮ್ಮ ಇಬ್ಬರೂ ನಾ ಮುಂದೆ ತಾ ಮುಂದೆ ಎನ್ನುತ್ತಾರೆ ! ಆದರೆ ಯಾರೂ ಮುಂದೆ ಹೋಗುವುದಿಲ್ಲ !	ಕಾಲುಗಳು
thinkbangalore_Kannada_33	ಹೋಗುತ್ತಾ ಬರುತ್ತಾ ಇರುವುದು ಎರಡು , ಎರಡೂ ಹೋದ ಮೇಲೆ ಬರಲಾರವು	ಸಿರಿತನ - ಬಡತನ , ಪ್ರಾಣ - ಮಾನ
thinkbangalore_Kannada_34	ಕಚ್ಚಿದರೆ ಮಾತ್ರ ಕಚ್ಚುವುದು ! ಕಚ್ಚಲ್ಲ , ಹಾವಲ್ಲ , ಚೇಳಲ್ಲ	ಮೆಣಸಿನ ಕಾಯಿ
thinkbangalore_Kannada_35	ಅಂಗಡಿಯಲ್ಲಿ ತರೋದು ಅದರ ಮುಂದು ಕೂತು ಅಳೋದು	ಈರುಳ್ಳಿ
vishaya_Kannada_1	ನೀರಲ್ಲೆ ಹುಟ್ಟುತ್ತೆ ! ನೀರಲ್ಲೆ ಬೆಳೆಯುತ್ತೆ ! ನೀರು ಕಂಡ ಕೂಡಲೆ ಕರಗಿ ಹೋಗುತ್ತೆ !	ಉಪ್ಪು
vishaya_Kannada_2	ಅಪ್ಪನ ದುಡ್ಡು ಎಣಿಸೊಕಾಗಲ್ಲ , ಅವ್ವನ ಸೀರೆ ಮಡಿಸೊಕ್ಕಾಗಲ್ಲ	ನಕ್ಷತ್ರ ಆಕಾಶ
vishaya_Kannada_3	ಕಿರಿ ಮನೆಗೆ ಚಿನ್ನದ ಬೀಗ	ಮೂಗುತಿ
vishaya_Kannada_4	ಊರಿಗೆಲ್ಲ ಒಂದೇ ಕಂಬ್ಳಿ	ಆಕಾಶ
vishaya_Kannada_5	ಯಾರೂ ಹತ್ತಲಾರದ ಮರಕ್ಕೆ ಸರಗೂರು ಕರಿಯಪ್ಪ ಹತ್ತುತ್ತಾನೆ	ಇರುವೆ
vishaya_Kannada_6	ಎಷ್ಟೇ ಮಳೆ ಬಂದರೂ ನೆನೆಯುವುದಿಲ್ಲ	ಎಮ್ಮೆ ಕೆಚ್ಚಲು
vishaya_Kannada_7	ಮರದೊಳಗೆ ಮರ ಹುಟ್ಟಿ , ಭೂ ಚಕ್ರದ ಹಣ್ಣಾಗಿ , ತಿನ್ನಬಾರದ ಹಣ್ಣು ಬಲು ಚಂದ	ಎಳೇ ಕೂಸು
vishaya_Kannada_8	ಊರಿನಲ್ಲಿ ಕುರಿ ಕೂಗಿದರೆ ಮೈಯೆಲ್ಲಾ ತೂತು	ಒಂದರಿ
vishaya_Kannada_9	ಮಳೆ ಹುಯ್ಲಿ , ಹುಯ್ದೆ ಇರ್ಲಿ ಬಾಯಲ್ಲಾ ಕೆಂಪು , ಮೈಯೆಲ್ಲಾ ಹಸಿರು	ಗಿಳಿ
vishaya_Kannada_10	ನೀರುಂಟ್ಟು ಬಾವಿಯಲ್ಲ , ಜುಟ್ಟುಂಟು ಪೂಜಾರಿಯಲ್ಲ , ಮೂರು ಕಣ್ಣುಂಟು ಶಿವನಲ್ಲ	ತೆಂಗಿನಕಾಯಿ
vishaya_Kannada_11	ಒಳ್ಳೆ ಕೋಳಿ ಮುಳ್ಳಲಿ ಮೊಟ್ಟೆ ಇಕ್ಕದೆ	ನಿಂಬೆಹಣ್ಣು
vishaya_Kannada_12	ತಂದವರೊಬ್ಬರು ! ಹಿಡಿದವರೊಬ್ಬರು ! ಹೊತ್ತವರೊಬ್ಬರು	ಬಳೆ
vishaya_Kannada_13	ಬಿಳಿ ಹುಡುಗನಿಗೆ ಕರಿಟೋಪಿ ,	ಬೆಂಕಿ ಕಡ್ಡಿ
